{
  "about": "Polly's architecture: the one source the dependency check and the architecture view read (constitution VII). Tiers top first within each group. A path segment * makes one module per directory; a file belongs to the tier of its longest matching path. A change to this file carries its reason in the pull request.",
  "ignore": ["**/*.test.ts", "**/*.test.tsx", "**/test/**", "**/vitest.config.ts", "**/vite.config.ts"],
  "tiers": [
    {
      "id": "interfaces",
      "group": "back",
      "name": "Routes & workflows",
      "criterion": "One process each. Parse, authorize, call one flow, answer. Its main.ts, the composition root, alone wires the adapters.",
      "paths": ["apps/api/src", "apps/api/src/entry", "apps/mcp/src", "apps/worker/src"],
      "mayImport": [
        "flows",
        {
          "tier": "domains",
          "typesOnly": true
        },
        {
          "tier": "adapters",
          "onlyFrom": [
            "apps/*/src/main.ts",
            "apps/*/src/cli.ts",
            "apps/api/src/entry/main.ts",
            "apps/api/src/entry/cli.ts"
          ]
        },
        "kernel",
        "socle",
        "contract"
      ],
      "isolated": "Two processes never import each other: share through a package below.",
      "technologies": [
        "node:*",
        "hono",
        "@hono/node-server",
        "zod",
        "@modelcontextprotocol/server",
        "@dbos-inc/dbos-sdk"
      ],
      "fix": "A route calls one flow; only a composition root (main.ts, or cli.ts for a command) imports an adapter package, and hands what it builds to the flows through their ports.",
      "typesFix": "A route uses a domain's types only: what it needs done goes through a flow.",
      "technologyFix": "A route speaks HTTP or MCP and validates with Zod; any other technology sits in a capacity package, behind a port."
    },
    {
      "id": "flows",
      "group": "back",
      "name": "Flows",
      "criterion": "One use case each: chain domain calls through their ports, compute nothing, no technology.",
      "paths": ["packages/back/src/flows/*"],
      "mayImport": [
        "domains",
        {
          "tier": "kernel",
          "typesOnly": true
        },
        "socle"
      ],
      "isolated": "Two flows never import each other: compose them in the process that calls them.",
      "technologies": [],
      "fix": "A flow chains domains and computes nothing: move the computation into a domain, the technology into a capacity package behind a port.",
      "typesFix": "A flow imports only types from the kernel: a value it needs comes from a domain.",
      "technologyFix": "A flow knows no technology: declare a port in the domain it calls and implement it in a capacity package."
    },
    {
      "id": "domains",
      "group": "back",
      "name": "Domains",
      "criterion": "Product rules. A domain declares a port (an exported interface, in its own words) for what it needs; no technology, no Node built-in.",
      "paths": ["packages/back/src/domains/*"],
      "mayImport": ["kernel", "socle"],
      "isolated": "Two domains never import each other: declare a port in the importing domain and feed it from a flow.",
      "technologies": [],
      "fix": "A domain imports only the kernel and the socle.",
      "technologyFix": "A domain knows no technology: declare a port and implement it in a capacity package."
    },
    {
      "id": "adapters",
      "group": "back",
      "name": "Adapters",
      "criterion": "One package per capacity, named by what it provides: implements the domains' ports with one technology. May depend on a lower capacity, never in a cycle.",
      "paths": [
        "packages/database",
        "packages/identity",
        "packages/queue",
        "packages/storage",
        "packages/logging",
        "packages/analysis",
        "packages/migrations"
      ],
      "mayImport": [
        "adapters",
        {
          "tier": "domains",
          "typesOnly": true
        },
        "kernel",
        "socle"
      ],
      "fix": "An adapter implements ports: it imports the domains' types, the kernel, the socle and lower capacities, nothing above."
    },
    {
      "id": "kernel",
      "group": "back",
      "name": "Kernel",
      "criterion": "Polly's pure values (ids, the event code, scores) and the one hash function. No rule, no other technology.",
      "paths": ["packages/kernel"],
      "mayImport": ["socle"],
      "technologies": ["node:crypto"],
      "fix": "The kernel holds values: a rule goes to a domain.",
      "technologyFix": "The kernel uses node:crypto for its hash and nothing else."
    },
    {
      "id": "socle",
      "group": "back",
      "name": "Socle",
      "criterion": "What every process shares, with no product word and no chosen technology: Refusal, the Logger and Clock ports, the configuration schema.",
      "paths": ["packages/platform"],
      "mayImport": [],
      "technologies": ["zod"],
      "fix": "The socle imports nothing of Polly.",
      "technologyFix": "The socle chooses no technology beyond the schema library."
    },
    {
      "id": "contract",
      "group": "back",
      "name": "Contract",
      "criterion": "Generated from the API's routes: its client, its schemas and the refusal codes. Never edited by hand.",
      "paths": ["packages/contract"],
      "mayImport": [],
      "fix": "The contract is generated and imports nothing of Polly."
    },
    {
      "id": "web-app",
      "group": "web",
      "name": "Web app",
      "criterion": "The front end's entry: providers, router, global styles.",
      "paths": ["apps/web/src/app"],
      "mayImport": ["web-pages", "web-widgets", "web-features", "web-entities", "web-shared", "contract"],
      "fix": "Feature-Sliced Design: a layer imports only the layers below it."
    },
    {
      "id": "web-pages",
      "group": "web",
      "name": "Web pages",
      "criterion": "One screen each.",
      "paths": ["apps/web/src/pages/*"],
      "mayImport": ["web-widgets", "web-features", "web-entities", "web-shared", "contract"],
      "isolated": "Two pages never import each other: move what they share down a layer.",
      "fix": "Feature-Sliced Design: a page imports only the layers below it."
    },
    {
      "id": "web-widgets",
      "group": "web",
      "name": "Web widgets",
      "criterion": "Self-contained blocks of a page.",
      "paths": ["apps/web/src/widgets/*"],
      "mayImport": ["web-features", "web-entities", "web-shared", "contract"],
      "isolated": "Two widgets never import each other: move what they share down a layer.",
      "fix": "Feature-Sliced Design: a widget imports only the layers below it."
    },
    {
      "id": "web-features",
      "group": "web",
      "name": "Web features",
      "criterion": "One user action each.",
      "paths": ["apps/web/src/features/*"],
      "mayImport": ["web-entities", "web-shared", "contract"],
      "isolated": "Two features never import each other: compose them in a widget or a page.",
      "fix": "Feature-Sliced Design: a feature imports only entities and shared."
    },
    {
      "id": "web-entities",
      "group": "web",
      "name": "Web entities",
      "criterion": "Product objects as the front end shows them.",
      "paths": ["apps/web/src/entities/*"],
      "mayImport": ["web-shared", "contract"],
      "isolated": "Two entities never import each other: compose them in a feature.",
      "fix": "Feature-Sliced Design: an entity imports only shared."
    },
    {
      "id": "web-shared",
      "group": "web",
      "name": "Web shared",
      "criterion": "No product word: the API client, i18n, UI primitives.",
      "paths": ["apps/web/src/shared/*"],
      "mayImport": ["contract"],
      "isolated": "Two shared segments never import each other: merge them or split what they share.",
      "fix": "Shared knows no layer above it."
    },
    {
      "id": "plugin",
      "group": "plugin",
      "name": "Plugin",
      "criterion": "The Claude Code plugin's scripts: the monitor. Reaches Polly through the generated contract only.",
      "paths": ["plugin/monitors", "plugin/src"],
      "mayImport": ["contract"],
      "technologies": ["node:*"],
      "fix": "The plugin reaches Polly through the generated contract only.",
      "technologyFix": "The monitor is bundled from Node built-ins and the contract only."
    },
    {
      "id": "dev-entry",
      "group": "dev",
      "name": "Dev entry",
      "criterion": "The dev commands' composition root: parses the command line, wires the real adapters.",
      "paths": ["dev/src/main.ts", "dev/src/real.ts"],
      "mayImport": [
        "dev-entry",
        "dev-commands",
        "dev-e2e",
        "dev-worktree",
        "dev-supervisor",
        "dev-infra",
        "dev-machine",
        "dev-ports",
        "dev-config",
        "dev-identity",
        "socle"
      ],
      "fix": "The dev entry wires the tiers below it."
    },
    {
      "id": "dev-commands",
      "group": "dev",
      "name": "Dev commands",
      "criterion": "One command each (up, down, worker, e2e, url, agent), written against the ports.",
      "paths": ["dev/src/commands"],
      "mayImport": [
        "dev-e2e",
        "dev-worktree",
        "dev-supervisor",
        "dev-infra",
        "dev-machine",
        "dev-ports",
        "dev-config",
        "dev-identity",
        "socle"
      ],
      "fix": "A dev command imports only the dev tiers below it."
    },
    {
      "id": "dev-e2e",
      "group": "dev",
      "name": "Dev end-to-end",
      "criterion": "The driven agent run and its scenarios.",
      "paths": ["dev/src/e2e"],
      "mayImport": [
        "dev-worktree",
        "dev-supervisor",
        "dev-infra",
        "dev-machine",
        "dev-ports",
        "dev-config",
        "dev-identity",
        "socle",
        "flows"
      ],